{
  "$schema": "https://json-schema.org/draft/2020-12/schema",
  "$id": "https://github.com/sonar-solutions/sonar-migration-tool/schemas/config.schema.json",
  "title": "sonar-migration-tool unified configuration",
  "description": "Unified config file shape consumed by every sonar-migration-tool command (extract, migrate, reset, predictive-report). Issue #266.",
  "type": "object",
  "additionalProperties": false,
  "properties": {
    "concurrency": {
      "type": "integer",
      "minimum": 1,
      "default": 10,
      "description": "Default max parallel HTTP calls. Overridden per command by source.concurrency / target.concurrency."
    },
    "project_data_build_concurrency": {
      "type": "integer",
      "minimum": 1,
      "default": 4,
      "description": "Default max number of scanner reports built at once during project-data migration. Overridden by target.project_data_build_concurrency. Lower it if the migration runs out of memory on a large instance; raise it toward concurrency if report building is the bottleneck."
    },
    "timeout": {
      "type": "integer",
      "minimum": 1,
      "default": 60,
      "description": "Default HTTP request timeout in seconds. Paginated reads by extract, including the extract step of transfer and sync-issues, wait up to twice this. Overridden per command by source.timeout / target.timeout."
    },
    "export_directory": {
      "type": "string",
      "default": "./migration-files",
      "description": "Root directory for extract / migrate output."
    },
    "skip_issue_sync": {
      "oneOf": [
        { "type": "boolean" },
        { "type": "integer", "enum": [0, 1] },
        { "type": "string", "pattern": "^(?i)(true|false|on|off|yes|no|0|1)$" }
      ],
      "default": false,
      "description": "When true (or on / yes / 1), skip the final per-issue and per-hotspot metadata sync after project data is replayed. Defaults to false so the sync happens. Issue #299."
    },
    "skip_project_data_migration": {
      "oneOf": [
        { "type": "boolean" },
        { "type": "integer", "enum": [0, 1] },
        { "type": "string", "pattern": "^(?i)(true|false|on|off|yes|no|0|1)$" }
      ],
      "default": false,
      "description": "When true (or on / yes / 1), skip the entire project-data migration: the project-data import AND the trailing issue + hotspot sync. Implies skip_issue_sync. Defaults to false so the data is migrated. Issue #303."
    },
    "objects": {
      "type": "array",
      "items": {
        "type": "string",
        "enum": [
          "settings", "permission_templates", "quality_profiles", "quality_gates",
          "projects", "portfolios", "groups", "license_profiles",
          "qp", "qg", "pt", "lp"
        ]
      },
      "description": "Object categories to extract / migrate — extract and migrate only. Omit (or leave empty) to process every category, the default. When set without \"projects\", no project is created/extracted/migrated. Aliases: qp=quality_profiles, qg=quality_gates, pt=permission_templates, lp=license_profiles. license_profiles is accepted but not yet implemented (logs a warning and is otherwise ignored). Issue #536."
    },
    "project_key": {
      "type": ["string", "null"],
      "deprecated": true,
      "description": "DEPRECATED — use project_key_regexp instead (issue #592); still honoured with a WARN, and project_key_regexp takes precedence if both are set. Regexp pattern of source project keys to extract / migrate / sync-issues; on extract/migrate only applies when \"projects\" is selected via objects (or objects is unset). Implicitly anchored (^...$); a plain key with no regex metacharacters matches only itself. Issue #536."
    },
    "project_key_regexp": {
      "type": ["string", "null"],
      "description": "Regexp pattern of source project keys to extract / migrate / sync-issues; on extract/migrate only applies when \"projects\" is selected via objects (or objects is unset). Implicitly anchored (^...$); a plain key with no regex metacharacters matches only itself. Applies to both source (extract, also read by sync-issues) and target (migrate) unless overridden by source.project_key_regexp / target.project_key_regexp. Replaces the deprecated project_key. Issue #536, #592."
    },
    "branch_regexp": {
      "type": ["string", "null"],
      "description": "Regexp pattern of branch names to extract / migrate, implicitly anchored (^...$); a plain name with no regex metacharacters matches only itself. Applies to both source (extract) and target (migrate) unless overridden by source.branch_regexp / target.branch_regexp. If migrate does not set it, migrate implicitly operates on whatever branches were actually extracted. The project's main branch is always included regardless of match. Omit to process every branch (default). Issue #582."
    },
    "migrate_history": {
      "oneOf": [
        { "type": "boolean" },
        { "type": "integer", "enum": [0, 1] },
        { "type": "string", "pattern": "^(?i)(true|false|on|off|yes|no|0|1)$" }
      ],
      "default": false,
      "description": "PoC (issue #554): when true (or on / yes / 1), also migrate a bounded set of historical analysis snapshots (date + project-level measures only) per migrated branch (every branch, not just main — #625), backdated on SonarQube Cloud. Defaults to false — no change to existing behavior unless set."
    },
    "history_max_points": {
      "type": "integer",
      "minimum": 0,
      "default": 0,
      "description": "PoC (issue #554): max historical snapshots migrated per branch (not per project — each migrated branch gets its own cap) when migrate_history is set. 0 (the default) means no cap: every historical analysis is a candidate. Pass a positive number to bound it."
    },
    "history_min_interval_days": {
      "type": "integer",
      "minimum": 0,
      "default": 0,
      "description": "PoC (issue #554): minimum spacing, in days, enforced between two migrated historical snapshots of the same branch when migrate_history is set. 0 (the default) means no spacing rule: every analysis in the source history is a candidate. 0 is a real value, not a 'not set' marker: an explicit 0 is kept as is, and an absent key also resolves to 0. A positive number keeps at most one point per that many days."
    },
    "branch_analyzed_after": {
      "type": ["string", "null"],
      "pattern": "^(\\d{4}-\\d{2}-\\d{2})?$",
      "description": "Issue #583: only select branches whose last analysis is on or after this YYYY-MM-DD date, for extract/migrate/transfer. Omit (or leave empty) to select every branch, the default. The project's main branch is always selected regardless, even if it doesn't meet this date. Warns if the date is more than 2 years (730 days) in the past. Overridable per command by source.branch_analyzed_after / target.branch_analyzed_after."
    },
    "max_issue_comments": {
      "type": "integer",
      "minimum": 0,
      "maximum": 20,
      "default": 5,
      "description": "Max most-recent source comments replayed onto each migrated issue/hotspot (default 5, max 20). Reduces SonarQube Cloud API pressure on long comment threads. Issue #571. Overridable via target.max_issue_comments."
    },
    "source": {
      "$ref": "#/$defs/sourceBlock",
      "description": "SonarQube Server connection + extract-time options. Consumed by `extract` (and ignored by `migrate` / `reset`)."
    },
    "target": {
      "$ref": "#/$defs/targetBlock",
      "description": "SonarQube Cloud connection + migrate/reset-time options. Consumed by `migrate` and `reset` (and ignored by `extract`)."
    }
  },
  "anyOf": [
    { "required": ["source"] },
    { "required": ["target"] }
  ],
  "$defs": {
    "edition": {
      "type": "string",
      "enum": ["enterprise", "team", "foss"],
      "default": "enterprise"
    },
    "sourceBlock": {
      "type": "object",
      "additionalProperties": false,
      "required": ["url", "token"],
      "properties": {
        "url": {
          "type": "string",
          "format": "uri",
          "description": "SonarQube Server base URL. Mandatory."
        },
        "token": {
          "type": "string",
          "minLength": 1,
          "description": "SonarQube Server user token. Mandatory."
        },
        "extract_type": {
          "type": "string",
          "default": "all",
          "description": "Extract scope. \"all\" extracts every available task; otherwise the name of a specific extract task."
        },
        "concurrency": {
          "type": ["integer", "null"],
          "minimum": 1,
          "description": "Override the top-level concurrency for extract calls."
        },
        "timeout": {
          "type": ["integer", "null"],
          "minimum": 1,
          "description": "Override the top-level timeout for extract HTTP calls."
        },
        "pem_file_path": {
          "type": ["string", "null"],
          "description": "Path to a client-side certificate PEM file for mTLS to SonarQube Server."
        },
        "key_file_path": {
          "type": ["string", "null"],
          "description": "Path to the private key matching pem_file_path."
        },
        "cert_password": {
          "type": ["string", "null"],
          "description": "Password for the client certificate, if any."
        },
        "insecure": {
          "type": "boolean",
          "default": false,
          "description": "Skip TLS certificate verification for the SonarQube Server connection. For a trusted internal server whose certificate is self-signed or not signed by a trusted CA. Leaves the connection open to man-in-the-middle interception; never use against a public endpoint."
        },
        "target_task": {
          "type": ["string", "null"],
          "description": "Stop extract at a specific task (all its dependencies are still run)."
        },
        "extract_id": {
          "type": ["string", "null"],
          "description": "Reuse an existing extract directory ID instead of generating a new one."
        },
        "branch_regexp": {
          "type": ["string", "null"],
          "description": "Overrides the top-level branch_regexp for extract. Regexp pattern of branch names to extract, implicitly anchored (^...$). The project's main branch is always extracted regardless of match. Issue #582."
        },
        "project_key_regexp": {
          "type": ["string", "null"],
          "description": "Overrides the top-level project_key_regexp for extract. Regexp pattern of project keys to extract, implicitly anchored (^...$); a plain key matches only itself. Only applies when \"projects\" is selected via objects (or objects is unset). Issue #592."
        },
        "branch_analyzed_after": {
          "type": ["string", "null"],
          "pattern": "^(\\d{4}-\\d{2}-\\d{2})?$",
          "description": "Issue #583: overrides the top-level branch_analyzed_after for extract only. An explicit empty string clears any top-level value, so extract sees every branch even if migrate is filtered. When absent, the top-level branch_analyzed_after applies."
        },
        "enterprise_key": {
          "type": ["string", "null"],
          "description": "PROVISIONAL — ignored today; reserved for future SQC-to-SQC migration source side."
        },
        "organization_key": {
          "type": ["string", "null"],
          "description": "PROVISIONAL — ignored today; reserved for future SQC-to-SQC migration source side."
        },
        "edition": {
          "$ref": "#/$defs/edition",
          "description": "PROVISIONAL — ignored today; the SQS edition is read live from /api/navigation/global."
        },
        "run_id": {
          "type": ["string", "null"],
          "description": "Ignored by extract (kept here for shape symmetry with target)."
        }
      }
    },
    "targetBlock": {
      "type": "object",
      "additionalProperties": false,
      "required": ["url", "token"],
      "properties": {
        "url": {
          "type": "string",
          "format": "uri",
          "description": "SonarQube Cloud base URL (e.g. https://sonarcloud.io/). Mandatory."
        },
        "token": {
          "type": "string",
          "minLength": 1,
          "description": "SonarQube Cloud user token. Mandatory."
        },
        "enterprise_key": {
          "type": ["string", "null"],
          "description": "SonarQube Cloud enterprise key used to scope create/list/delete enterprise endpoints."
        },
        "edition": {
          "$ref": "#/$defs/edition",
          "description": "SonarQube Cloud edition used to gate edition-specific tasks."
        },
        "concurrency": {
          "type": ["integer", "null"],
          "minimum": 1,
          "description": "Override the top-level concurrency for migrate/reset calls."
        },
        "project_data_build_concurrency": {
          "type": ["integer", "null"],
          "minimum": 1,
          "description": "Override the top-level project_data_build_concurrency for migrate calls."
        },
        "timeout": {
          "type": ["integer", "null"],
          "minimum": 1,
          "description": "Override the top-level timeout for migrate/reset HTTP calls."
        },
        "run_id": {
          "type": ["string", "null"],
          "description": "Resume an in-progress migrate run by ID. Null starts a fresh run."
        },
        "target_task": {
          "type": ["string", "null"],
          "description": "Stop migrate at a specific task (all its dependencies are still run)."
        },
        "branch_regexp": {
          "type": ["string", "null"],
          "description": "Overrides the top-level branch_regexp for migrate. Regexp pattern of branch names to migrate, implicitly anchored (^...$). Only branches that were actually extracted can be migrated; when unset, migrate implicitly operates on whatever branches were actually extracted. The project's main branch is always migrated regardless of match. Issue #582."
        },
        "project_key_regexp": {
          "type": ["string", "null"],
          "description": "Overrides the top-level project_key_regexp for migrate. Regexp pattern of source project keys to migrate, implicitly anchored (^...$); a plain key matches only itself. Only applies when \"projects\" is selected via objects (or objects is unset). Not to be confused with project_key_pattern (the target-key rendering template). Issue #592."
        },
        "organization_key": {
          "type": ["string", "null"],
          "description": "PROVISIONAL — ignored today; reserved for future SQC-org-to-SQC-org migration target side."
        },
        "default_organization": {
          "type": ["string", "null"],
          "description": "SonarQube Cloud organization key applied to every project when organizations.csv has no mapping defined. Ignored (with a WARN) when at least one row in organizations.csv carries a sonarcloud_org_key. CLI --default_organization overrides this. Issue #281."
        },
        "project_key_pattern": {
          "type": ["string", "null"],
          "default": "<ORGANIZATION_KEY>_<ORIGINAL_PROJECT_KEY>",
          "description": "Template for target SonarQube Cloud project keys, built from the placeholders <ORIGINAL_PROJECT_KEY> (mandatory) and <ORGANIZATION_KEY>. Defaults to <ORGANIZATION_KEY>_<ORIGINAL_PROJECT_KEY>. A single <ORIGINAL_PROJECT_KEY> with a static prefix requires a prefix of at least 5 characters; a bare <ORIGINAL_PROJECT_KEY> keeps the key unchanged. CLI --project_key_pattern overrides this. Issue #138."
        },
        "migrate_history": {
          "oneOf": [
            { "type": "boolean" },
            { "type": "integer", "enum": [0, 1] },
            { "type": "string", "pattern": "^(?i)(true|false|on|off|yes|no|0|1)$" }
          ],
          "description": "PoC (issue #554): overrides the top-level migrate_history for migrate/reset. When true (or on / yes / 1), also migrate a bounded set of historical analysis snapshots (date + project-level measures only) per migrated branch (every branch, not just main — #625), backdated on SonarQube Cloud. When absent, the top-level migrate_history applies (default false)."
        },
        "branch_analyzed_after": {
          "type": ["string", "null"],
          "pattern": "^(\\d{4}-\\d{2}-\\d{2})?$",
          "description": "Issue #583: overrides the top-level branch_analyzed_after for migrate only. An explicit empty string clears any top-level value, so migrate sees every branch even if extract was filtered. When absent, the top-level branch_analyzed_after applies. On transfer, the single --branch_analyzed_after CLI flag sets source.branch_analyzed_after and target.branch_analyzed_after identically; use this config field directly for independent per-phase cutoffs."
        },
        "max_issue_comments": {
          "type": ["integer", "null"],
          "minimum": 0,
          "maximum": 20,
          "description": "Override the top-level max_issue_comments for migrate / transfer / sync-issues. Ignored by reset, which replays no comments. Issue #571."
        }
      }
    }
  }
}
