{
  "concurrency": 10,
  "timeout": 60,
  "export_directory": "./migration-files",
  "skip_issue_sync": false,
  "skip_project_data_migration": false,
  "objects": [
    "settings", "permission_templates", "quality_profiles", "quality_gates",
    "projects", "portfolios", "groups"
  ],
  "project_key_regexp": null,
  "migrate_history": false,
  "history_max_points": 10,
  "history_min_interval_days": 30,
  "branch_analyzed_after": null,
  "source": {
    "url": "https://sonarqube.example.com",
    "token": "squ_xxxxxxxxxxxxxxxxxxxxxxxxxxxxxxxxxxxxxxxx",
    "extract_type": "all",
    "concurrency": 10,
    "timeout": 60,
    "pem_file_path": null,
    "key_file_path": null,
    "cert_password": null,
    "insecure": false,
    "target_task": null,
    "extract_id": null,
    "enterprise_key": null,
    "organization_key": null,
    "edition": "enterprise",
    "branch_analyzed_after": null
  },
  "target": {
    "url": "https://sonarcloud.io/",
    "token": "xxxxxxxxxxxxxxxxxxxxxxxxxxxxxxxxxxxxxxxx",
    "enterprise_key": null,
    "edition": "enterprise",
    "concurrency": 10,
    "timeout": 60,
    "run_id": null,
    "target_task": null,
    "organization_key": null,
    "project_key_pattern": "<ORGANIZATION_KEY>_<ORIGINAL_PROJECT_KEY>",
    "branch_analyzed_after": null
  }
}
